{
  "$schema": "./edge-rules.schema.json",
  "description": "Single source of truth for redirects and response headers on pequeverso.com. tools/gen-htaccess.ts renders it to out/.htaccess (static target); config/next.ts attaches it as redirects()/headers() (standalone target). The old-domain cutover block lives in docs/migration/old-domain.htaccess and is not part of this file. The ?offer=downsell alias is handled client-side by the offer-mode script (no redirect, to avoid query-merge loops).",
  "canonicalHost": "pequeverso.com",
  "hsts": {
    "enabled": true,
    "maxAge": 300,
    "includeSubDomains": false,
    "note": "Raise maxAge to 31536000 only after apex and www have served valid HTTPS for a week (docs/migration.md)."
  },
  "redirects": [
    {
      "id": "legacy-hub",
      "description": "WordPress hub path pasted on the new domain.",
      "source": "/pequeverso/",
      "destination": "/",
      "permanent": true
    },
    {
      "id": "legacy-main",
      "description": "WordPress and /products/ aliases of the principal landing (query preserved).",
      "source": "/pequeverso/grafismo-fonetico/",
      "destination": "/grafismo-fonetico/",
      "permanent": true
    },
    {
      "id": "legacy-main-products",
      "source": "/products/grafismo-fonetico/",
      "destination": "/grafismo-fonetico/",
      "permanent": true
    },
    {
      "id": "legacy-upsell",
      "description": "Upsell/downsell aliases; ?downsell=1 and attribution params are preserved by both targets.",
      "source": "/pequeverso/imprime-y-juega/",
      "destination": "/imprime-y-juega/",
      "permanent": true
    },
    {
      "id": "legacy-upsell-products",
      "source": "/products/kit-imprime-y-juega/",
      "destination": "/imprime-y-juega/",
      "permanent": true
    },
    {
      "id": "legacy-thank-you",
      "source": "/pequeverso/grafismo-fonetico/gracias/",
      "destination": "/grafismo-fonetico/gracias/",
      "permanent": true
    },
    {
      "id": "legacy-thank-you-products",
      "source": "/products/grafismo-fonetico-gracias/",
      "destination": "/grafismo-fonetico/gracias/",
      "permanent": true
    },
    {
      "id": "affiliate-alimentacion-bebe",
      "description": "Affiliate product recommended by Pequeverso (Hotmart course «Guía de Alimentación para Bebés»). Destination = build variable NEXT_PUBLIC_CHECKOUT_URL_ALIMENTACION_BEBE (the owner's hotlink); 302 so the link can change; the visitor's query is appended. Unset variable: no rule, the path 404s.",
      "source": "/alimentacion-bebe/",
      "destinationEnv": "NEXT_PUBLIC_CHECKOUT_URL_ALIMENTACION_BEBE",
      "permanent": false
    },
    {
      "id": "prior-owner-shop",
      "description": "URLs indexed from the previous owner of pequeverso.com (Montessori shop). Return 410 Gone.",
      "source": "/shop-2/:path*",
      "gone": true
    }
  ],
  "headers": [
    {
      "id": "security",
      "source": "/:path*",
      "headers": {
        "X-Content-Type-Options": "nosniff",
        "Referrer-Policy": "strict-origin-when-cross-origin",
        "Permissions-Policy": "camera=(), microphone=(), geolocation=(), payment=(), browsing-topics=()",
        "X-Frame-Options": "SAMEORIGIN",
        "Content-Security-Policy-Report-Only": "default-src 'self'; script-src 'self' 'unsafe-inline' https://checkout.hotmart.com https://*.hotmart.com https://connect.facebook.net https://cloud.umami.is; style-src 'self' 'unsafe-inline'; img-src 'self' data: https:; font-src 'self'; connect-src 'self' https://*.hotmart.com https://www.facebook.com https://connect.facebook.net https://cloud.umami.is https://api-gateway.umami.dev; frame-src https://*.hotmart.com https://www.facebook.com; media-src 'self'; object-src 'none'; base-uri 'self'; form-action 'self' https://*.hotmart.com; frame-ancestors 'self'",
        "Cache-Control": "no-cache"
      },
      "description": "Applies to every response; later rules override Cache-Control for immutable assets and build-info. HTML is never CDN-cached (Cloudflare/Hostinger CDN respect origin Cache-Control)."
    },
    {
      "id": "html-no-cache",
      "source": "/:path*.html",
      "headers": {
        "Cache-Control": "no-cache"
      }
    },
    {
      "id": "build-info",
      "source": "/build-info.json",
      "headers": {
        "Cache-Control": "no-store"
      }
    },
    {
      "id": "api-no-store",
      "description": "Server endpoints (Meta CAPI relay at /api/meta/events) are never cached by Cloudflare or the browser; no redirect rule touches /api/.",
      "source": "/api/:path*",
      "headers": {
        "Cache-Control": "no-store"
      }
    },
    {
      "id": "immutable-media",
      "source": "/media/:path*",
      "headers": {
        "Cache-Control": "public, max-age=31536000, immutable"
      }
    },
    {
      "id": "immutable-fonts",
      "source": "/fonts/:path*",
      "headers": {
        "Cache-Control": "public, max-age=31536000, immutable"
      }
    },
    {
      "id": "immutable-next-static",
      "source": "/_next/static/:path*",
      "headers": {
        "Cache-Control": "public, max-age=31536000, immutable"
      }
    }
  ]
}
